{
  "training_readiness": "ready",
  "trainable": true,
  "reason": "ready",
  "can_prepare": false,
  "can_start_training": true,
  "current_preparation": {
    "id": "preparation-fixture",
    "fingerprint": "7910984c15895ded12541fce56860cce217a7419c99102aebef1d32f17ed7ef0",
    "state": "accepted",
    "phase": "accepted",
    "created_at": "2026-07-14T00:00:00Z",
    "updated_at": "2026-07-14T00:01:00Z",
    "failure_phase": null,
    "failure_reason": null,
    "report_sha256": "3333333333333333333333333333333333333333333333333333333333333333",
    "report_ready": true,
    "can_retry": false
  }
}
